{
  "schema": "crowsi://control/certificate-authority-outcome-evidence/v2",
  "evidence_id": "authority.evidence.sample",
  "nonce_base64": "AQEBAQEBAQEBAQEBAQEBAQEBAQEBAQEBAQEBAQEBAQE",
  "issuer": "authority://crowsi/certificate",
  "audience": "service://crowsi/policy-administrator",
  "action": "issue",
  "authorization_jti": "authorization.jti.sample",
  "operation_id": "operation.certificate.sample",
  "lease_digest_sha256": "1010101010101010101010101010101010101010101010101010101010101010",
  "authorization_command_digest_sha256": "2020202020202020202020202020202020202020202020202020202020202020",
  "target_resource_id": "resource.certificate.sample",
  "expected_resource_version": 0,
  "previous_fence": 0,
  "current_fence": 1,
  "previous_lifecycle_revocation_epoch": 0,
  "lifecycle_revocation_epoch": 0,
  "disposition": "completed",
  "authority_outcome_digest_sha256": "3030303030303030303030303030303030303030303030303030303030303030",
  "original_authorization_jti": null,
  "original_operation_id": null,
  "original_lease_digest_sha256": null,
  "original_action": null,
  "original_authority_command_digest_sha256": null,
  "original_unknown_evidence_digest_sha256": null,
  "lifecycle_reservation_id": null,
  "original_previous_fence": null,
  "original_current_fence": null,
  "original_previous_lifecycle_revocation_epoch": null,
  "original_lifecycle_revocation_epoch": null,
  "security_domain": "security.crowsi",
  "deployment_id": "deployment.local",
  "trust_revision": 7,
  "authority_id": "authority.crowsi.local",
  "receipt_key_id": "authority.receipt.key",
  "receipt_key_version": "version.0001",
  "receipt_public_key_spki_sha256": "4040404040404040404040404040404040404040404040404040404040404040",
  "receipt_signature_algorithm": "ecdsa-p256-sha256-p1363-low-s",
  "receipt_key_purpose": "certificate-authority-receipt",
  "issued_at_epoch_s": 10000,
  "expires_at_epoch_s": 10030,
  "signed": {
    "key_id": "authority.receipt.key",
    "key_version": "version.0001",
    "public_key_spki_sha256": "4040404040404040404040404040404040404040404040404040404040404040",
    "key_purpose": "certificate-authority-receipt",
    "algorithm": "ecdsa-p256-sha256-p1363-low-s",
    "digest_sha256": "3594290f29ccbbf0f916620e8b3968f6b766ea9c49e78f569211701f179348c7",
    "signature_base64": "AAAAAAAAAAAAAAAAAAAAAAAAAAAAAAAAAAAAAAAAAAAAAAAAAAAAAAAAAAAAAAAAAAAAAAAAAAAAAAAAAAAAAA=="
  }
}
